{"format":"takya-evidence-v1","package_id":"pkg_Gg6Gg6Gg6Gg6Gg6Gg6","created_at":"2026-10-19T15:06:00Z","level":"E1","source_id":"src_Bb1Bb1Bb1Bb1Bb1Bb1","files":[{"path":"sources/source.mp4","size_bytes":8388608,"sha256":"aaaaaaaaaaaaaaaaaaaaaaaaaaaaaaaaaaaaaaaaaaaaaaaaaaaaaaaaaaaaaaaa","role":"source"},{"path":"derivatives/clip.mp4","size_bytes":2000000,"sha256":"bbbbbbbbbbbbbbbbbbbbbbbbbbbbbbbbbbbbbbbbbbbbbbbbbbbbbbbbbbbbbbbb","role":"derivative_clip"},{"path":"analysis.json","size_bytes":900,"sha256":"cccccccccccccccccccccccccccccccccccccccccccccccccccccccccccccccc","role":"analysis"},{"path":"decision.json","size_bytes":500,"sha256":"cccccccccccccccccccccccccccccccccccccccccccccccccccccccccccccccc","role":"decision"}],"relations":[{"from":"derivatives/clip.mp4","to":"sources/source.mp4","kind":"derived_from"}],"transformations":[{"tool":"ffmpeg","tool_version":"6.1.1","operation":"stream_copy_cut","audio_removed":false}],"context":{"requested":{"start_ms":0,"end_ms":39500},"effective":{"start_ms":0,"end_ms":39500},"mapping_proven":true},"analysis_ref":"analysis.json","decision_ref":"decision.json","capture_time":null,"identity_scope":"none","review_status":"HUMAN_REVIEWED"}
